名称,月销售量,配送费,起送价,风味,评分,配送时长,评分统计,距离,地址
有一家芝士焗饭(武生店),283,1,8,简餐,4.2,37,37,897,武汉市新洲区阳逻街桥头村六组481号
非常食惠（武生店）,1338,1,0,盖浇饭,4.5,37,129,980,武汉市新洲区阳逻街武汉生物工程学院商业街西区6号
红点点餐厅(武生店),3042,0,10,简餐,4.3,32,144,577,武汉市新洲区阳逻街汉施路1号武生院东区商业街B212号
麦乐仕芝士饭（武生店）,2742,1,8,简餐,4.6,36,430,58,武汉市新洲区阳逻街武汉生物工程学院西区商业街4号
名称,月销售量,配送费,起送价,风味,评分,配送时长,评分统计,距离,地址
巴蜀人家餐厅（武生店）,4069,0,5,盖浇饭,4.3,32,172,812,武汉市新洲区阳逻街汉施路特1号武生院商业街B216号
零食小子,737,5,100,便利店,4.8,37,60,580,武汉市新洲区阳逻经济开发区汉施路1号/栋1-3（武汉生物工程学院）
菜小二生鲜(四季美农贸城店),1,0,0,蔬菜豆品,0,55,0,21102,合肥市蜀山区潜山路与望江路东侧海卉文化生活街B区B061
尚希蛋糕鲜花(洪山店),10,0,0,鲜花,5,41,0,32255,武汉市武昌区珞涵屯4栋1门502号
尚希蛋糕鲜花(江岸店),6,0,0,甜品,5,47,0,26926,武汉市江岸区二七街解放大道2159号航天星都汉口东部购物公园C2栋20层11室
艺仟禧鲜花烘焙(武商店),1,5,20,蛋糕,5,44,0,19837,武汉市青山区40/41街坊江南春城15栋1-2层8室商网（-28)
希里蛋糕鲜花武汉店,3,10,0,鲜花,0,40,0,26319,武汉市江岸区汉口城市广场六期5幢5号楼单元4层6号房
猫lin的铺,90,2,0,地方小吃,4.8,36,0,60,武汉市新洲区阳逻街武生院商业街C区154
